SQL> @flada_dml.sql
Connected.
SQL> set serveroutput on
SQL> -- set verify on
SQL> set term on
SQL> set lines 200
SQL> set pages 44
SQL> set pause on
SQL>
SQL> /*== Query the current salary for Mr. Fox ==*/
SQL>
SQL> SELECT employee_id, last_name, salary
  2  FROM   hr.employees
  3  WHERE  last_name = 'Fox';

EMPLOYEE_ID LAST_NAME                     SALARY  
----------- ------------------------- ----------  
        170 Fox                             9600  

SQL>
SQL> pause Press [Enter] to continue...
Press [Enter] to continue...

SQL>
SQL> /*== Increase the  salary three times by 1000 ==*/
SQL>
SQL> UPDATE hr.employees
  2  SET salary = salary + 1000
  3  WHERE last_name = 'Fox'
  4  /

1 row updated.

SQL> COMMIT
  2  /

Commit complete.

SQL> UPDATE hr.employees
  2  SET salary = salary + 1000
  3  WHERE last_name = 'Fox'
  4  /

1 row updated.

SQL> COMMIT
  2  /

Commit complete.

SQL> UPDATE hr.employees
  2  SET    salary = salary + 1000
  3  WHERE  last_name = 'Fox'
  4  /

1 row updated.

SQL> COMMIT
  2  /

Commit complete.

SQL> pause Press [Enter] to continue...
Press [Enter] to continue...

SQL>
SQL> /*== Query the up-to-date value for Mr. Fox ==*/
SQL>
SQL> SELECT employee_id, last_name, salary
  2  FROM   hr.employees
  3  WHERE  last_name = 'Fox';

EMPLOYEE_ID LAST_NAME                     SALARY  
----------- ------------------------- ----------  
        170 Fox                            12600  

SQL>
SQL> pause  Press [Enter] to continue...
Press [Enter] to continue...

SQL>
SQL> SELECT employee_id, last_name, salary
  2  FROM hr.employees
  3  VERSIONS BETWEEN TIMESTAMP
  4  (SYSTIMESTAMP - INTERVAL '10' MINUTE) AND SYSTIMESTAMP
  5  WHERE last_name = 'Fox'
  6  /

EMPLOYEE_ID LAST_NAME                     SALARY  
----------- ------------------------- ----------  
        170 Fox                            12600  
        170 Fox                            11600  
        170 Fox                            10600  
        170 Fox                             9600  

SQL> set pause off
SQL> exit
